{
  "schema_version": "BetaSessionAssignment.v1",
  "assignment_id": "22222222-2222-4222-8222-222222222222",
  "session_id": "33333333-3333-4333-8333-333333333333",
  "profile_id": "11111111-1111-4111-8111-111111111111",
  "tester_id": "synthetic-tester-001",
  "product_id": "author_forge",
  "application_id": "com.boswell.authorforge",
  "build_id": "5b7765113ead1465f4d8a3802abfc7e34e8a9b07",
  "repository": "Boswell-Digital-Solutions/Author-Forge",
  "commit": "5b7765113ead1465f4d8a3802abfc7e34e8a9b07",
  "platform_policy": ["windows", "macos", "linux"],
  "assigned_sections": [
    {"section_id": "launch_and_hearth", "required": true},
    {"section_id": "project_creation", "required": true},
    {"section_id": "smithy_editor", "required": true},
    {"section_id": "foundry_structure", "required": true},
    {"section_id": "export_and_close", "required": true}
  ],
  "free_exploration_allowed": true,
  "privacy_profile": "synthetic-disposable-no-real-manuscript-v1",
  "expires_at": "2026-12-31T23:59:59Z"
}

